"","Variable type","Example variable","Module","Survey"
"213","Knowledge of female circumcision","Ever heard of female circumcision (women)","Female Genital Cutting","Women"
"214","Prevalence of female circumcision","Women circumcised (FGC)","Female Genital Cutting","Women"
"215","Type of female circumcision","Circumcised women who were cut but no flesh was removed","Female Genital Cutting","Women"
"216","Age at circumcision","Women circumcised before age 5","Female Genital Cutting","Women"
"217","Age at circumcision of girls 0-14","Girls circumcised before age 1","Female Genital Cutting","Children"
"218","Prevalence of circumcision of girls","Girls age 0-4 circumcised","Female Genital Cutting","Children"
"219","Infibulation among circumcised girls","Circumcised girls age 0-14 infibulated","Female Genital Cutting","Children"
"220","Person who performed the circumcision of girls","Girls age 0-14 circumcised by a traditional agent","Female Genital Cutting","Children"
"221","Person who performed the circumcision of women","Women circumcised by a traditional agent","Female Genital Cutting","Women"
"222","Opinions about whether circumcision is required by religion ","Women's opinion that religion requires female circumcision","Female Genital Cutting","Women"
"223","Opinions about whether the practice of circumcision should continue","Women who believe that female circumcision should be continued","Female Genital Cutting","Women"
"224","Experience of fistula symptoms","Women currently experiencing fistula symptoms","Fistula","Women"
"225","Reported causes of fistula symptoms","Women who reported the cause of their fistula as a normal labor and delivery, baby born alive","Fistula","Women"
"226","Days after reported fistula cause that symptoms began","Women who reported that fistula symptoms began 0-1 day after the reported cause","Fistula","Women"
"227","Fistula treatment","Women who sought treatment for fistula symptoms","Fistula","Women"
"228","Fistula treatment provider","Women with fistula-like symptoms who sought treatment from a doctor","Fistula","Women"
"229","Fistula treatment outcome","Women with fistula-like symptoms whose treatment stopped leakage completely","Fistula","Women"
"230","Reasons for not seeking treatment for fistula","Women with fistula-like symptoms who did not seek treatment because they did not know problem can be fixed","Fistula","Women"
"231","Birth registration","Children who had a birth certificate","Child Protection","Children"
"232","Child discipline","Children 2-14 who experienced only non-violent discipline","Child Protection","Children"
"233","Child labor of children age 5-11","Children age 5-11 involved in paid work outside household","Child Protection","Children"
"234","Child labor of children age 12-14","Children age 12-14 involved in paid work outside household","Child Protection","Children"
"235","Child labor of children age 5-14","Children age 5-14 involved in child labor","Child Protection","Children"
"236","Child labor and school attendance","Children age 5-14 involved in child labor","Child Protection","Children"
"237","School attendance by survivorship of parents","Current school attendance rate of orphans aged 10-14","Education","Children"
"238","Educational attainment of the household population","Female population age 6 and over with no education","Education","Women"
"239","Net attendance ratio - primary","Net primary school attendance rate: Female","Education","Women"
"240","Gross attendance ratio - primary","Gross primary school attendance rate: Female","Education","Women"
"241","Net attendance ratio - secondary","Net secondary school attendance rate: Female","Education","Women"
"242","Gross attendance ratio - secondary","Gross secondary school attendance rate: Female","Education","Women"
"243","Early childhood education participation","Children attending an early childhood education program","Education","Children"
"244","Highest level of schooling","Women with no education","Education","Women"
"245","Literacy","Women with secondary or higher education","Education","Women"
"246","Literacy - Youth","Young women with secondary or higher education","Education","Women"
"247","Exposure to mass media","Women who read a newspaper at least once a week","Education","Women"
"248","Employment status","Women who worked in the last 12 months and are currently","Employment","Women"
"249","Occupation","Women's occupation: Professional, technical, managerial","Employment","Women"
"250","Type of employment","Women who worked for cash only","Employment","Women"
"251","Employment of married persons","Married women employed in the last 12 months","Employment","Women"
"252","Earnings of married persons","Married women who worked for cash only","Employment","Women"
"253","Control over women's cash earnings","Women who decide themselves how their earnings are used","Employment","Women"
"254","Relative magnitude of women's cash earnings","Wife earns more than husband","Employment","Women"
"255","Control over husband's cash earnings","Women who decide herself how her husband's earnings are used","Employment","Women"
"256","Source of drinking water","Households using an improved water source","Water and Sanitation","Households"
"257","Time to obtain drinking water (round trip)","Households with water on the premises","Water and Sanitation","Households"
"258","Person collecting drinking water","Population with no drinking water on premises","Water and Sanitation","Population"
"259","Water treatment prior to drinking","Households treating water by boiling","Water and Sanitation","Households"
"260","Availability of water","Households with water not available for at least one day","Water and Sanitation","Households"
"261","Availability of sufficient drinking water","Drinking water available in sufficient quantities","Water and Sanitation","Population"
"262","Household sanitation facilities","Households with an improved sanitation facility","Water and Sanitation","Households"
"263","Location of toilet facilities","Households with sanitation facility in own dwelling","Water and Sanitation","Households"
"264","Emptying and removal of waste","Wastes were removed by a service provider to treatment plant","Water and Sanitation","Population"
"265","Management of household excreta","Population connected to sewer","Water and Sanitation","Population"
"266","Handwashing","Households with a fixed place for handwashing was observed","Water and Sanitation","Households"
"267","Menstrual hygiene","Used reusable sanitary pads during last menstrual period","Water and Sanitation","Women"
"268","Electricity","Households with electricity","Household Characteristics","Households"
"269","Flooring material","Households with natural floors","Household Characteristics","Households"
"270","Rooms used for sleeping","Households with one room for sleeping","Household Characteristics","Households"
"271","Place for cooking","Households cooking in the house","Household Characteristics","Households"
"272","Cooking technology","Households cooking with clean fuels and technologies","Household Characteristics","Households"
"273","Cooking fuel","Households cooking with electricity","Household Characteristics","Households"
"274","Heating technology","Households using central heating","Household Characteristics","Households"
"275","Heating fuel","Households using clean fuels and technologies for heating","Household Characteristics","Households"
"276","Lighting fuel or technology","Households using clean fuels and technologies for lighting","Household Characteristics","Households"
"277","Clean fuels and technologies","Population with primary reliance on clean fuels and technologies for cooking","Household Characteristics","Population"
"278","Frequency of smoking in the home","Households with smoking in the household daily","Household Characteristics","Households"
"279","Household characteristics","Households total","Household Characteristics","Households"
"280","Persons per sleeping room","Households with 1-2 persons per sleeping room","Household Characteristics","Households"
"281","Household effects","Households possessing a radio","Household Characteristics","Households"
"282","Household means of transport","Households possessing a bicycle","Household Characteristics","Households"
"283","Agricultural ownership","Households owning agricultural land","Household Characteristics","Households"
"284","Wealth quintiles","Population in the lowest wealth quintile","Household Characteristics","Population"
"285","Age of population","Percentage of population age 0-4","Household Characteristics","Population"
"286","Older age persons","Households with members age 65+","Household Characteristics","Households"
"287","Youth Characteristics","Percentage of young women","Household Characteristics","Women"
"288","Household headship","Male-headed households","Household Characteristics","Households"
"289","Number of usual members","Households with 0 usual members","Household Characteristics","Households"
"290","Households with orphans and foster children","Households with foster children","Household Characteristics","Households"
"291","Children's living arrangements and orphanhood","Children living with both parents","Household Characteristics","Children"
"292","Children 10-14 living arrangements and orphanhood","Children age 10-14 living with both parents","Household Characteristics","Children"
"293","Results of the household interviews","Sample implementation: Households completed","Survey Characteristics","Households"
"294","Results of the individual interviews","Sample implementation: Eligible women completed","Survey Characteristics","Women"
"295","Results of the household interviews for men's subsample","Men's survey sample implementation: Households completed","Survey Characteristics","Households"
"296","Interview date and duration","Median date of interview","Survey Characteristics","Households"
"297","Background characteristics","Percentage of women","Survey Characteristics","Women"
